"No.","Time","Source","Destination","Protocol","Length","Info"
"1","0.000000","::","ff02::1:ff7d:838c","ICMPv6","78","Neighbor Solicitation for fe80::c0a7:bb78:7d7d:838c"
"2","0.000043","fe80::c0a7:bb78:7d7d:838c","ff02::1","ICMPv6","86","Neighbor Advertisement fe80::c0a7:bb78:7d7d:838c (rtr, ovr) is at 2c:cf:67:1c:40:40"
"3","1.009086","::","ff02::1:ff7d:838c","ICMPv6","78","Neighbor Solicitation for fe80::c0a7:bb78:7d7d:838c"
"4","1.009115","fe80::c0a7:bb78:7d7d:838c","ff02::1","ICMPv6","86","Neighbor Advertisement fe80::c0a7:bb78:7d7d:838c (rtr, ovr) is at 2c:cf:67:1c:40:40"
"5","2.015825","::","ff02::1:ff7d:838c","ICMPv6","78","Neighbor Solicitation for fe80::c0a7:bb78:7d7d:838c"
"6","2.015896","fe80::c0a7:bb78:7d7d:838c","ff02::1","ICMPv6","86","Neighbor Advertisement fe80::c0a7:bb78:7d7d:838c (rtr, ovr) is at 2c:cf:67:1c:40:40"
"7","3.029473","::","ff02::1:ff7d:838c","ICMPv6","78","Neighbor Solicitation for fe80::c0a7:bb78:7d7d:838c"
"8","3.029508","fe80::c0a7:bb78:7d7d:838c","ff02::1","ICMPv6","86","Neighbor Advertisement fe80::c0a7:bb78:7d7d:838c (rtr, ovr) is at 2c:cf:67:1c:40:40"
"9","4.043230","::","ff02::1:ff7d:838c","ICMPv6","78","Neighbor Solicitation for fe80::c0a7:bb78:7d7d:838c"
"10","4.043264","fe80::c0a7:bb78:7d7d:838c","ff02::1","ICMPv6","86","Neighbor Advertisement fe80::c0a7:bb78:7d7d:838c (rtr, ovr) is at 2c:cf:67:1c:40:40"
"11","5.067259","::","ff02::1:ff7d:838c","ICMPv6","78","Neighbor Solicitation for fe80::c0a7:bb78:7d7d:838c"
"12","5.067314","fe80::c0a7:bb78:7d7d:838c","ff02::1","ICMPv6","86","Neighbor Advertisement fe80::c0a7:bb78:7d7d:838c (rtr, ovr) is at 2c:cf:67:1c:40:40"
"13","5.828335","10.42.0.105","10.42.0.21","TCP","74","37314  >  9999 [SYN] Seq=0 Win=65535 Len=0 MSS=1460 SACK_PERM TSval=347535045 TSecr=0 WS=1024"
"14","5.828384","10.42.0.21","10.42.0.105","TCP","58","9999  >  37314 [SYN, ACK] Seq=0 Ack=1 Win=1452 Len=0 MSS=1452"
"15","5.830786","10.42.0.105","10.42.0.21","TCP","54","37314  >  9999 [ACK] Seq=1 Ack=1 Win=65535 Len=0"
"16","5.830901","10.42.0.105","10.42.0.21","TPLINK-SMARTHOME/JSON","160","TCP Cmd: {""context"":{""source"":""46a4d58b-6279-432c-ae23-e115c2db8354""},""system"":{""set_relay_state"":{""state"":0}}}"
"17","5.831433","10.42.0.21","10.42.0.105","TCP","54","[TCP Window Update] 9999  >  37314 [ACK] Seq=1 Ack=1 Win=4356 Len=0"
"18","5.832164","10.42.0.21","10.42.0.105","TCP","54","9999  >  37314 [ACK] Seq=1 Ack=107 Win=3630 Len=0"
"19","5.854276","10.42.0.21","10.42.0.105","TCP","54","[TCP Window Update] 9999  >  37314 [ACK] Seq=1 Ack=107 Win=4356 Len=0"
"20","5.855996","10.42.0.21","10.42.0.105","TPLINK-SMARTHOME/JSON","103","TCP Rsp: {""system"":{""set_relay_state"":{""err_code"":0}}}"
"21","5.857607","10.42.0.105","10.42.0.21","TCP","54","37314  >  9999 [ACK] Seq=107 Ack=50 Win=65535 Len=0"
"22","5.858180","10.42.0.21","10.42.0.105","TCP","54","[TCP Dup ACK 18#1] 9999  >  37314 [ACK] Seq=50 Ack=107 Win=4356 Len=0"
"23","5.859002","10.42.0.105","10.42.0.21","TCP","54","37314  >  9999 [FIN, ACK] Seq=107 Ack=50 Win=65535 Len=0"
"24","5.859538","10.42.0.21","10.42.0.105","TCP","54","9999  >  37314 [ACK] Seq=50 Ack=108 Win=3630 Len=0"
"25","5.911124","10.42.0.21","3.217.132.36","TCP","58","56461  >  443 [SYN] Seq=0 Win=1452 Len=0 MSS=1452"
"26","6.002009","10.42.0.21","10.42.0.105","TCP","54","9999  >  37314 [FIN, ACK] Seq=50 Ack=108 Win=2904 Len=0"
"27","6.002061","10.42.0.105","10.42.0.21","TCP","54","37314  >  9999 [ACK] Seq=108 Ack=51 Win=65535 Len=0"
"28","6.011594","3.217.132.36","10.42.0.21","TCP","58","443  >  56461 [SYN, ACK] Seq=0 Ack=1 Win=26883 Len=0 MSS=1360"
"29","6.012250","10.42.0.21","3.217.132.36","TCP","54","56461  >  443 [ACK] Seq=1 Ack=1 Win=4080 Len=0"
"30","6.087373","::","ff02::1:ff7d:838c","ICMPv6","78","Neighbor Solicitation for fe80::c0a7:bb78:7d7d:838c"
"31","6.087401","fe80::c0a7:bb78:7d7d:838c","ff02::1","ICMPv6","86","Neighbor Advertisement fe80::c0a7:bb78:7d7d:838c (rtr, ovr) is at 2c:cf:67:1c:40:40"
"32","6.148215","10.42.0.21","3.217.132.36","TLSv1.2","196","Client Hello"
"33","6.241644","3.217.132.36","10.42.0.21","TLSv1.2","1414","Server Hello"
"34","6.242674","3.217.132.36","10.42.0.21","TCP","1414","443  >  56461 [ACK] Seq=1361 Ack=143 Win=65535 Len=1360 [TCP segment of a reassembled PDU]"
"35","6.242783","3.217.132.36","10.42.0.21","TCP","1414","[TCP Window Full] 443  >  56461 [ACK] Seq=2721 Ack=143 Win=65535 Len=1360 [TCP segment of a reassembled PDU]"
"36","6.246103","10.42.0.21","3.217.132.36","TCP","54","56461  >  443 [ACK] Seq=143 Ack=1361 Win=3400 Len=0"
"37","6.246392","10.42.0.21","3.217.132.36","TCP","54","56461  >  443 [ACK] Seq=143 Ack=2721 Win=3400 Len=0"
"38","6.246447","10.42.0.21","3.217.132.36","TCP","54","56461  >  443 [ACK] Seq=143 Ack=4081 Win=3400 Len=0"
"39","6.336415","3.217.132.36","10.42.0.21","TLSv1.2","1180","Certificate"
"40","6.336427","3.217.132.36","10.42.0.21","TLSv1.2","401","Server Key Exchange, Server Hello Done"
"41","6.451567","10.42.0.21","3.217.132.36","TCP","54","56461  >  443 [ACK] Seq=143 Ack=5207 Win=3400 Len=0"
"42","6.703338","10.42.0.21","3.217.132.36","TLSv1.2","180","Client Key Exchange, Change Cipher Spec, Encrypted Handshake Message"
"43","6.703482","10.42.0.21","3.217.132.36","TCP","54","[TCP Dup ACK 42#1] 56461  >  443 [ACK] Seq=269 Ack=5554 Win=3400 Len=0"
"44","6.793686","3.217.132.36","10.42.0.21","TLSv1.2","105","Change Cipher Spec, Encrypted Handshake Message"
"45","6.800552","10.42.0.21","3.217.132.36","TCP","54","56461  >  443 [ACK] Seq=269 Ack=5605 Win=3400 Len=0"
"46","6.854829","10.42.0.21","3.217.132.36","TLSv1.2","601","Application Data"
"47","6.951354","3.217.132.36","10.42.0.21","TLSv1.2","1280","Application Data"
"48","6.951367","3.217.132.36","10.42.0.21","TLSv1.2","88","Application Data"
"49","6.961998","10.42.0.21","3.217.132.36","TCP","54","56461  >  443 [ACK] Seq=816 Ack=6831 Win=3400 Len=0"
"50","6.962517","10.42.0.21","3.217.132.36","TCP","54","56461  >  443 [ACK] Seq=816 Ack=6865 Win=3400 Len=0"
"51","7.006002","10.42.0.21","3.217.132.36","TCP","54","56461  >  443 [FIN, ACK] Seq=816 Ack=6865 Win=3400 Len=0"
"52","7.097389","3.217.132.36","10.42.0.21","TCP","54","443  >  56461 [ACK] Seq=6865 Ack=817 Win=65535 Len=0"
"53","7.097396","3.217.132.36","10.42.0.21","TCP","54","443  >  56461 [FIN, ACK] Seq=6865 Ack=817 Win=65535 Len=0"
"54","7.101157","10.42.0.21","3.217.132.36","TCP","54","56461  >  443 [ACK] Seq=817 Ack=6866 Win=3399 Len=0"
"55","7.102003","::","ff02::1:ff7d:838c","ICMPv6","78","Neighbor Solicitation for fe80::c0a7:bb78:7d7d:838c"
"56","7.102032","fe80::c0a7:bb78:7d7d:838c","ff02::1","ICMPv6","86","Neighbor Advertisement fe80::c0a7:bb78:7d7d:838c (rtr, ovr) is at 2c:cf:67:1c:40:40"
"57","8.128907","::","ff02::1:ff7d:838c","ICMPv6","78","Neighbor Solicitation for fe80::c0a7:bb78:7d7d:838c"
"58","8.128942","fe80::c0a7:bb78:7d7d:838c","ff02::1","ICMPv6","86","Neighbor Advertisement fe80::c0a7:bb78:7d7d:838c (rtr, ovr) is at 2c:cf:67:1c:40:40"
"59","8.808702","64.233.184.188","10.42.0.105","TLSv1.2","90","Application Data"
"60","8.991362","10.42.0.105","10.42.0.21","TCP","74","54746  >  9999 [SYN] Seq=0 Win=65535 Len=0 MSS=1460 SACK_PERM TSval=347538200 TSecr=0 WS=1024"
"61","8.991387","10.42.0.21","10.42.0.105","TCP","58","9999  >  54746 [SYN, ACK] Seq=0 Ack=1 Win=1452 Len=0 MSS=1452"
"62","8.991406","10.42.0.105","10.42.0.21","TCP","54","54746  >  9999 [ACK] Seq=1 Ack=1 Win=65535 Len=0"
"63","8.991670","10.42.0.21","10.42.0.105","TCP","54","[TCP Window Update] 9999  >  54746 [ACK] Seq=1 Ack=1 Win=4356 Len=0"
"64","8.991824","10.42.0.105","10.42.0.21","TPLINK-SMARTHOME/JSON","160","TCP Cmd: {""context"":{""source"":""46a4d58b-6279-432c-ae23-e115c2db8354""},""system"":{""set_relay_state"":{""state"":1}}}"
"65","8.992672","10.42.0.21","10.42.0.105","TCP","54","9999  >  54746 [ACK] Seq=1 Ack=107 Win=3630 Len=0"
"66","9.023587","10.42.0.21","10.42.0.105","TCP","54","[TCP Window Update] 9999  >  54746 [ACK] Seq=1 Ack=107 Win=4356 Len=0"
"67","9.025652","10.42.0.21","10.42.0.105","TPLINK-SMARTHOME/JSON","103","TCP Rsp: {""system"":{""set_relay_state"":{""err_code"":0}}}"
"68","9.029401","10.42.0.105","10.42.0.21","TCP","54","54746  >  9999 [ACK] Seq=107 Ack=50 Win=65535 Len=0"
"69","9.029492","10.42.0.105","10.42.0.21","TCP","54","54746  >  9999 [FIN, ACK] Seq=107 Ack=50 Win=65535 Len=0"
"70","9.030678","10.42.0.21","10.42.0.105","TCP","54","[TCP Dup ACK 65#1] 9999  >  54746 [ACK] Seq=50 Ack=107 Win=4356 Len=0"
"71","9.031158","10.42.0.21","10.42.0.105","TCP","54","9999  >  54746 [ACK] Seq=50 Ack=108 Win=3630 Len=0"
"72","9.037446","64.233.184.188","10.42.0.105","TCP","90","[TCP Retransmission] 5228  >  46974 [PSH, ACK] Seq=1 Ack=1 Win=1050 Len=24 TSval=3504819902 TSecr=3433601354"
"73","9.041918","10.42.0.105","64.233.184.188","TCP","66","46974  >  5228 [ACK] Seq=1 Ack=25 Win=81 Len=0 TSval=3433631675 TSecr=3504819902"
"74","9.076322","10.42.0.105","64.233.184.188","TLSv1.2","94","Application Data"
"75","9.092360","64.233.184.188","10.42.0.105","TCP","66","5228  >  46974 [ACK] Seq=25 Ack=29 Win=1050 Len=0 TSval=3504819957 TSecr=3433631707"
"76","9.106825","10.42.0.21","3.217.132.36","TCP","58","56462  >  443 [SYN] Seq=0 Win=1452 Len=0 MSS=1452"
"77","9.152887","::","ff02::1:ff7d:838c","ICMPv6","78","Neighbor Solicitation for fe80::c0a7:bb78:7d7d:838c"
"78","9.152914","fe80::c0a7:bb78:7d7d:838c","ff02::1","ICMPv6","86","Neighbor Advertisement fe80::c0a7:bb78:7d7d:838c (rtr, ovr) is at 2c:cf:67:1c:40:40"
"79","9.169344","10.42.0.21","10.42.0.105","TCP","54","9999  >  54746 [FIN, ACK] Seq=50 Ack=108 Win=2904 Len=0"
"80","9.173997","10.42.0.105","10.42.0.21","TCP","54","54746  >  9999 [ACK] Seq=108 Ack=51 Win=65535 Len=0"
"81","9.199894","3.217.132.36","10.42.0.21","TCP","58","443  >  56462 [SYN, ACK] Seq=0 Ack=1 Win=26883 Len=0 MSS=1360"
"82","9.200513","10.42.0.21","3.217.132.36","TCP","54","56462  >  443 [ACK] Seq=1 Ack=1 Win=4080 Len=0"
"83","9.317388","10.42.0.21","3.217.132.36","TLSv1.2","196","Client Hello"
"84","9.411680","3.217.132.36","10.42.0.21","TLSv1.2","1414","Server Hello"
"85","9.411784","3.217.132.36","10.42.0.21","TCP","1414","443  >  56462 [ACK] Seq=1361 Ack=143 Win=65535 Len=1360 [TCP segment of a reassembled PDU]"
"86","9.411891","3.217.132.36","10.42.0.21","TCP","1414","[TCP Window Full] 443  >  56462 [ACK] Seq=2721 Ack=143 Win=65535 Len=1360 [TCP segment of a reassembled PDU]"
"87","9.415910","10.42.0.21","3.217.132.36","TCP","54","56462  >  443 [ACK] Seq=143 Ack=1361 Win=3400 Len=0"
"88","9.416122","10.42.0.21","3.217.132.36","TCP","54","56462  >  443 [ACK] Seq=143 Ack=2721 Win=3400 Len=0"
"89","9.416377","10.42.0.21","3.217.132.36","TCP","54","56462  >  443 [ACK] Seq=143 Ack=4081 Win=3400 Len=0"
"90","9.479194","10.42.0.105","224.0.0.251","MDNS","471","Standard query response 0x0000 PTR, cache flush Android_aa22d63ceebf436a968827fd2b8ea579.local AAAA, cache flush fe80::341e:55ff:fe77:cc8a PTR, cache flush Android_aa22d63ceebf436a968827fd2b8ea579.local A, cache flush 10.42.0.105 PTR 1Muhammad's A55E23B27FF._samsungflowauth._tcp.local SRV, cache flush 0 0 34895 Android_aa22d63ceebf436a968827fd2b8ea579.local TXT, cache flush PTR _samsungflowauth._tcp.local NSEC, cache flush A.8.C.C.7.7.E.F.F.F.5.5.E.1.4.3.0.0.0.0.0.0.0.0.0.0.0.0.0.8.E.F.ip6.arpa NSEC, cache flush Android_aa22d63ceebf436a968827fd2b8ea579.local NSEC, cache flush 105.0.42.10.in-addr.arpa NSEC, cache flush 1Muhammad's A55E23B27FF._samsungflowauth._tcp.local"
"91","9.485910","fe80::341e:55ff:fe77:cc8a","ff02::fb","MDNS","491","Standard query response 0x0000 PTR, cache flush Android_aa22d63ceebf436a968827fd2b8ea579.local AAAA, cache flush fe80::341e:55ff:fe77:cc8a PTR, cache flush Android_aa22d63ceebf436a968827fd2b8ea579.local A, cache flush 10.42.0.105 PTR 1Muhammad's A55E23B27FF._samsungflowauth._tcp.local SRV, cache flush 0 0 34895 Android_aa22d63ceebf436a968827fd2b8ea579.local TXT, cache flush PTR _samsungflowauth._tcp.local NSEC, cache flush A.8.C.C.7.7.E.F.F.F.5.5.E.1.4.3.0.0.0.0.0.0.0.0.0.0.0.0.0.8.E.F.ip6.arpa NSEC, cache flush Android_aa22d63ceebf436a968827fd2b8ea579.local NSEC, cache flush 105.0.42.10.in-addr.arpa NSEC, cache flush 1Muhammad's A55E23B27FF._samsungflowauth._tcp.local"
"92","9.487273","10.42.0.105","224.0.0.251","MDNS","471","Standard query response 0x0000 PTR, cache flush Android_aa22d63ceebf436a968827fd2b8ea579.local AAAA, cache flush fe80::341e:55ff:fe77:cc8a PTR, cache flush Android_aa22d63ceebf436a968827fd2b8ea579.local A, cache flush 10.42.0.105 PTR 1Muhammad's A55E23B27FF._samsungflownoti._tcp.local SRV, cache flush 0 0 39835 Android_aa22d63ceebf436a968827fd2b8ea579.local TXT, cache flush PTR _samsungflownoti._tcp.local NSEC, cache flush A.8.C.C.7.7.E.F.F.F.5.5.E.1.4.3.0.0.0.0.0.0.0.0.0.0.0.0.0.8.E.F.ip6.arpa NSEC, cache flush Android_aa22d63ceebf436a968827fd2b8ea579.local NSEC, cache flush 105.0.42.10.in-addr.arpa NSEC, cache flush 1Muhammad's A55E23B27FF._samsungflownoti._tcp.local"
"93","9.490840","fe80::341e:55ff:fe77:cc8a","ff02::fb","MDNS","491","Standard query response 0x0000 PTR, cache flush Android_aa22d63ceebf436a968827fd2b8ea579.local AAAA, cache flush fe80::341e:55ff:fe77:cc8a PTR, cache flush Android_aa22d63ceebf436a968827fd2b8ea579.local A, cache flush 10.42.0.105 PTR 1Muhammad's A55E23B27FF._samsungflownoti._tcp.local SRV, cache flush 0 0 39835 Android_aa22d63ceebf436a968827fd2b8ea579.local TXT, cache flush PTR _samsungflownoti._tcp.local NSEC, cache flush A.8.C.C.7.7.E.F.F.F.5.5.E.1.4.3.0.0.0.0.0.0.0.0.0.0.0.0.0.8.E.F.ip6.arpa NSEC, cache flush Android_aa22d63ceebf436a968827fd2b8ea579.local NSEC, cache flush 105.0.42.10.in-addr.arpa NSEC, cache flush 1Muhammad's A55E23B27FF._samsungflownoti._tcp.local"
"94","9.506413","3.217.132.36","10.42.0.21","TLSv1.2","1180","Certificate"
"95","9.506420","3.217.132.36","10.42.0.21","TLSv1.2","401","Server Key Exchange, Server Hello Done"
"96","9.574002","10.42.0.105","10.42.0.1","DNS","74","Standard query 0x745d A www.google.com"
"97","9.574071","10.42.0.1","10.42.0.105","DNS","170","Standard query response 0x745d A www.google.com A 108.177.15.103 A 108.177.15.104 A 108.177.15.99 A 108.177.15.105 A 108.177.15.106 A 108.177.15.147"
"98","9.619565","10.42.0.21","3.217.132.36","TCP","54","56462  >  443 [ACK] Seq=143 Ack=5207 Win=3400 Len=0"
"99","9.863608","10.42.0.21","3.217.132.36","TLSv1.2","180","Client Key Exchange, Change Cipher Spec, Encrypted Handshake Message"
"100","9.863730","10.42.0.21","3.217.132.36","TCP","54","[TCP Dup ACK 99#1] 56462  >  443 [ACK] Seq=269 Ack=5554 Win=3400 Len=0"
"101","9.953657","3.217.132.36","10.42.0.21","TLSv1.2","105","Change Cipher Spec, Encrypted Handshake Message"
"102","9.958224","10.42.0.21","3.217.132.36","TCP","54","56462  >  443 [ACK] Seq=269 Ack=5605 Win=3400 Len=0"
"103","10.013115","10.42.0.21","3.217.132.36","TLSv1.2","600","Application Data"
"104","10.111391","3.217.132.36","10.42.0.21","TLSv1.2","1279","Application Data"
"105","10.111398","3.217.132.36","10.42.0.21","TLSv1.2","88","Application Data"
"106","10.122373","10.42.0.21","3.217.132.36","TCP","54","56462  >  443 [ACK] Seq=815 Ack=6830 Win=3400 Len=0"
"107","10.122898","10.42.0.21","3.217.132.36","TCP","54","56462  >  443 [ACK] Seq=815 Ack=6864 Win=3400 Len=0"
"108","10.161037","::","ff02::1:ff7d:838c","ICMPv6","78","Neighbor Solicitation for fe80::c0a7:bb78:7d7d:838c"
"109","10.161063","fe80::c0a7:bb78:7d7d:838c","ff02::1","ICMPv6","86","Neighbor Advertisement fe80::c0a7:bb78:7d7d:838c (rtr, ovr) is at 2c:cf:67:1c:40:40"
"110","10.161178","10.42.0.21","3.217.132.36","TCP","54","56462  >  443 [FIN, ACK] Seq=815 Ack=6864 Win=3400 Len=0"
"111","10.251212","3.217.132.36","10.42.0.21","TCP","54","443  >  56462 [ACK] Seq=6864 Ack=816 Win=65535 Len=0"
"112","10.251239","3.217.132.36","10.42.0.21","TCP","54","443  >  56462 [FIN, ACK] Seq=6864 Ack=816 Win=65535 Len=0"
"113","10.256535","10.42.0.21","3.217.132.36","TCP","54","56462  >  443 [ACK] Seq=816 Ack=6865 Win=3399 Len=0"
"114","11.168079","::","ff02::1:ff7d:838c","ICMPv6","78","Neighbor Solicitation for fe80::c0a7:bb78:7d7d:838c"
"115","11.168115","fe80::c0a7:bb78:7d7d:838c","ff02::1","ICMPv6","86","Neighbor Advertisement fe80::c0a7:bb78:7d7d:838c (rtr, ovr) is at 2c:cf:67:1c:40:40"
"116","12.158236","10.42.0.105","10.42.0.21","TCP","74","54754  >  9999 [SYN] Seq=0 Win=65535 Len=0 MSS=1460 SACK_PERM TSval=347541368 TSecr=0 WS=1024"
"117","12.158288","10.42.0.21","10.42.0.105","TCP","58","9999  >  54754 [SYN, ACK] Seq=0 Ack=1 Win=1452 Len=0 MSS=1452"
"118","12.158735","10.42.0.105","10.42.0.21","TCP","54","54754  >  9999 [ACK] Seq=1 Ack=1 Win=65535 Len=0"
"119","12.158830","10.42.0.105","10.42.0.21","TPLINK-SMARTHOME/JSON","160","TCP Cmd: {""context"":{""source"":""46a4d58b-6279-432c-ae23-e115c2db8354""},""system"":{""set_relay_state"":{""state"":0}}}"
"120","12.159270","10.42.0.21","10.42.0.105","TCP","54","[TCP Window Update] 9999  >  54754 [ACK] Seq=1 Ack=1 Win=2904 Len=0"
"121","12.159725","10.42.0.21","10.42.0.105","TCP","54","9999  >  54754 [ACK] Seq=1 Ack=107 Win=2420 Len=0"
"122","12.178138","::","ff02::1:ff7d:838c","ICMPv6","78","Neighbor Solicitation for fe80::c0a7:bb78:7d7d:838c"
"123","12.178169","fe80::c0a7:bb78:7d7d:838c","ff02::1","ICMPv6","86","Neighbor Advertisement fe80::c0a7:bb78:7d7d:838c (rtr, ovr) is at 2c:cf:67:1c:40:40"
"124","12.183824","10.42.0.21","10.42.0.105","TCP","54","[TCP Window Update] 9999  >  54754 [ACK] Seq=1 Ack=107 Win=2904 Len=0"
"125","12.185551","10.42.0.21","10.42.0.105","TPLINK-SMARTHOME/JSON","103","TCP Rsp: {""system"":{""set_relay_state"":{""err_code"":0}}}"
"126","12.191316","10.42.0.105","10.42.0.21","TCP","54","54754  >  9999 [ACK] Seq=107 Ack=50 Win=65535 Len=0"
"127","12.191444","10.42.0.105","10.42.0.21","TCP","54","54754  >  9999 [FIN, ACK] Seq=107 Ack=50 Win=65535 Len=0"
"128","12.192070","10.42.0.21","10.42.0.105","TCP","54","[TCP Dup ACK 121#1] 9999  >  54754 [ACK] Seq=50 Ack=107 Win=2904 Len=0"
"129","12.193038","10.42.0.21","10.42.0.105","TCP","54","9999  >  54754 [ACK] Seq=50 Ack=108 Win=2420 Len=0"
"130","12.270303","10.42.0.21","3.217.132.36","TCP","58","56463  >  443 [SYN] Seq=0 Win=1452 Len=0 MSS=1452"
"131","12.333057","10.42.0.21","10.42.0.105","TCP","54","9999  >  54754 [FIN, ACK] Seq=50 Ack=108 Win=2904 Len=0"
"132","12.333079","10.42.0.105","10.42.0.21","TCP","54","54754  >  9999 [ACK] Seq=108 Ack=51 Win=65535 Len=0"
"133","12.362399","3.217.132.36","10.42.0.21","TCP","58","443  >  56463 [SYN, ACK] Seq=0 Ack=1 Win=26883 Len=0 MSS=1360"
"134","12.363048","10.42.0.21","3.217.132.36","TCP","54","56463  >  443 [ACK] Seq=1 Ack=1 Win=2720 Len=0"
"135","12.477676","10.42.0.21","3.217.132.36","TLSv1.2","196","Client Hello"
"136","12.573984","3.217.132.36","10.42.0.21","TLSv1.2","1414","Server Hello"
"137","12.574084","3.217.132.36","10.42.0.21","TCP","1414","[TCP Window Full] 443  >  56463 [ACK] Seq=1361 Ack=143 Win=65535 Len=1360 [TCP segment of a reassembled PDU]"
"138","12.578220","10.42.0.21","3.217.132.36","TCP","54","56463  >  443 [ACK] Seq=143 Ack=1361 Win=2266 Len=0"
"139","12.578479","10.42.0.21","3.217.132.36","TCP","54","56463  >  443 [ACK] Seq=143 Ack=2721 Win=2266 Len=0"
"140","12.669009","3.217.132.36","10.42.0.21","TCP","1414","443  >  56463 [ACK] Seq=2721 Ack=143 Win=65535 Len=1360 [TCP segment of a reassembled PDU]"
"141","12.672904","10.42.0.21","3.217.132.36","TCP","54","56463  >  443 [ACK] Seq=143 Ack=4081 Win=2266 Len=0"
"142","12.763907","3.217.132.36","10.42.0.21","TLSv1.2","1180","Certificate"
"143","12.763912","3.217.132.36","10.42.0.21","TLSv1.2","401","Server Key Exchange, Server Hello Done"
"144","12.879275","10.42.0.21","3.217.132.36","TCP","54","56463  >  443 [ACK] Seq=143 Ack=5207 Win=2266 Len=0"
"145","13.126888","10.42.0.21","3.217.132.36","TLSv1.2","180","Client Key Exchange, Change Cipher Spec, Encrypted Handshake Message"
"146","13.126940","10.42.0.21","3.217.132.36","TCP","54","[TCP Dup ACK 145#1] 56463  >  443 [ACK] Seq=269 Ack=5554 Win=2266 Len=0"
"147","13.182428","::","ff02::1:ff7d:838c","ICMPv6","78","Neighbor Solicitation for fe80::c0a7:bb78:7d7d:838c"
"148","13.182459","fe80::c0a7:bb78:7d7d:838c","ff02::1","ICMPv6","86","Neighbor Advertisement fe80::c0a7:bb78:7d7d:838c (rtr, ovr) is at 2c:cf:67:1c:40:40"
"149","13.217351","3.217.132.36","10.42.0.21","TLSv1.2","105","Change Cipher Spec, Encrypted Handshake Message"
"150","13.222988","10.42.0.21","3.217.132.36","TCP","54","56463  >  443 [ACK] Seq=269 Ack=5605 Win=2266 Len=0"
"151","13.276912","10.42.0.21","3.217.132.36","TLSv1.2","601","Application Data"
"152","13.376456","3.217.132.36","10.42.0.21","TLSv1.2","1280","Application Data"
"153","13.376469","3.217.132.36","10.42.0.21","TLSv1.2","88","Application Data"
"154","13.392077","10.42.0.21","3.217.132.36","TCP","54","56463  >  443 [ACK] Seq=816 Ack=6831 Win=2266 Len=0"
"155","13.392588","10.42.0.21","3.217.132.36","TCP","54","56463  >  443 [ACK] Seq=816 Ack=6865 Win=2266 Len=0"
"156","13.423834","10.42.0.21","3.217.132.36","TCP","54","56463  >  443 [FIN, ACK] Seq=816 Ack=6865 Win=2266 Len=0"
"157","13.516073","3.217.132.36","10.42.0.21","TCP","54","443  >  56463 [ACK] Seq=6865 Ack=817 Win=65535 Len=0"
"158","13.516083","3.217.132.36","10.42.0.21","TCP","54","443  >  56463 [FIN, ACK] Seq=6865 Ack=817 Win=65535 Len=0"
"159","13.519909","10.42.0.21","3.217.132.36","TCP","54","56463  >  443 [ACK] Seq=817 Ack=6866 Win=2265 Len=0"
"160","14.156463","10.42.0.105","10.42.0.21","TCP","74","54768  >  9999 [SYN] Seq=0 Win=65535 Len=0 MSS=1460 SACK_PERM TSval=347543366 TSecr=0 WS=1024"
"161","14.156488","10.42.0.21","10.42.0.105","TCP","58","9999  >  54768 [SYN, ACK] Seq=0 Ack=1 Win=1452 Len=0 MSS=1452"
"162","14.156597","10.42.0.105","10.42.0.21","TCP","54","54768  >  9999 [ACK] Seq=1 Ack=1 Win=65535 Len=0"
"163","14.156598","10.42.0.105","10.42.0.21","TPLINK-SMARTHOME/JSON","160","TCP Cmd: {""context"":{""source"":""46a4d58b-6279-432c-ae23-e115c2db8354""},""system"":{""set_relay_state"":{""state"":1}}}"
"164","14.156838","10.42.0.21","10.42.0.105","TCP","54","[TCP Window Update] 9999  >  54768 [ACK] Seq=1 Ack=1 Win=2904 Len=0"
"165","14.157336","10.42.0.21","10.42.0.105","TCP","54","9999  >  54768 [ACK] Seq=1 Ack=107 Win=2420 Len=0"
"166","14.201378","::","ff02::1:ff7d:838c","ICMPv6","78","Neighbor Solicitation for fe80::c0a7:bb78:7d7d:838c"
"167","14.201410","fe80::c0a7:bb78:7d7d:838c","ff02::1","ICMPv6","86","Neighbor Advertisement fe80::c0a7:bb78:7d7d:838c (rtr, ovr) is at 2c:cf:67:1c:40:40"
"168","14.272557","36:1e:55:77:cc:8a","Raspberr_1c:40:40","ARP","42","Who has 10.42.0.1? Tell 10.42.0.105"
"169","14.272569","Raspberr_1c:40:40","36:1e:55:77:cc:8a","ARP","42","10.42.0.1 is at 2c:cf:67:1c:40:40"
"170","14.290547","10.42.0.21","10.42.0.105","TCP","54","[TCP Window Update] 9999  >  54768 [ACK] Seq=1 Ack=107 Win=2904 Len=0"
"171","14.292699","10.42.0.21","10.42.0.105","TPLINK-SMARTHOME/JSON","103","TCP Rsp: {""system"":{""set_relay_state"":{""err_code"":0}}}"
"172","14.294280","10.42.0.105","10.42.0.21","TCP","54","54768  >  9999 [ACK] Seq=107 Ack=50 Win=65535 Len=0"
"173","14.294844","10.42.0.21","10.42.0.105","TCP","54","[TCP Dup ACK 165#1] 9999  >  54768 [ACK] Seq=50 Ack=107 Win=2904 Len=0"
"174","14.296179","10.42.0.105","10.42.0.21","TCP","54","54768  >  9999 [FIN, ACK] Seq=107 Ack=50 Win=65535 Len=0"
"175","14.298069","10.42.0.21","10.42.0.105","TCP","54","9999  >  54768 [ACK] Seq=50 Ack=108 Win=2420 Len=0"
"176","14.347337","10.42.0.21","3.217.132.36","TCP","58","56464  >  443 [SYN] Seq=0 Win=1452 Len=0 MSS=1452"
"177","14.432904","10.42.0.21","10.42.0.105","TCP","54","9999  >  54768 [FIN, ACK] Seq=50 Ack=108 Win=2178 Len=0"
"178","14.432929","10.42.0.105","10.42.0.21","TCP","54","54768  >  9999 [ACK] Seq=108 Ack=51 Win=65535 Len=0"
"179","14.441119","3.217.132.36","10.42.0.21","TCP","58","443  >  56464 [SYN, ACK] Seq=0 Ack=1 Win=26883 Len=0 MSS=1360"
"180","14.441746","10.42.0.21","3.217.132.36","TCP","54","56464  >  443 [ACK] Seq=1 Ack=1 Win=2720 Len=0"
"181","14.579906","10.42.0.21","3.217.132.36","TLSv1.2","196","Client Hello"
"182","14.675260","3.217.132.36","10.42.0.21","TLSv1.2","1414","Server Hello"
"183","14.675365","3.217.132.36","10.42.0.21","TCP","1414","[TCP Window Full] 443  >  56464 [ACK] Seq=1361 Ack=143 Win=65535 Len=1360 [TCP segment of a reassembled PDU]"
"184","14.679476","10.42.0.21","3.217.132.36","TCP","54","56464  >  443 [ACK] Seq=143 Ack=1361 Win=2266 Len=0"
"185","14.679747","10.42.0.21","3.217.132.36","TCP","54","56464  >  443 [ACK] Seq=143 Ack=2721 Win=2266 Len=0"
"186","14.770184","3.217.132.36","10.42.0.21","TCP","1414","443  >  56464 [ACK] Seq=2721 Ack=143 Win=65535 Len=1360 [TCP segment of a reassembled PDU]"
"187","14.774282","10.42.0.21","3.217.132.36","TCP","54","56464  >  443 [ACK] Seq=143 Ack=4081 Win=2266 Len=0"
"188","14.865114","3.217.132.36","10.42.0.21","TLSv1.2","1180","Certificate"
"189","14.865146","3.217.132.36","10.42.0.21","TLSv1.2","401","Server Key Exchange, Server Hello Done"
"190","14.980183","10.42.0.21","3.217.132.36","TCP","54","56464  >  443 [ACK] Seq=143 Ack=5207 Win=2266 Len=0"
"191","15.204889","::","ff02::1:ff7d:838c","ICMPv6","78","Neighbor Solicitation for fe80::c0a7:bb78:7d7d:838c"
"192","15.204921","fe80::c0a7:bb78:7d7d:838c","ff02::1","ICMPv6","86","Neighbor Advertisement fe80::c0a7:bb78:7d7d:838c (rtr, ovr) is at 2c:cf:67:1c:40:40"
"193","15.232509","10.42.0.21","3.217.132.36","TLSv1.2","180","Client Key Exchange, Change Cipher Spec, Encrypted Handshake Message"
"194","15.233285","10.42.0.21","3.217.132.36","TCP","54","[TCP Dup ACK 193#1] 56464  >  443 [ACK] Seq=269 Ack=5554 Win=2266 Len=0"
"195","15.323621","3.217.132.36","10.42.0.21","TLSv1.2","105","Change Cipher Spec, Encrypted Handshake Message"
"196","15.328213","10.42.0.21","3.217.132.36","TCP","54","56464  >  443 [ACK] Seq=269 Ack=5605 Win=2266 Len=0"
"197","15.384295","10.42.0.21","3.217.132.36","TLSv1.2","600","Application Data"
"198","15.481428","3.217.132.36","10.42.0.21","TLSv1.2","1279","Application Data"
"199","15.481442","3.217.132.36","10.42.0.21","TLSv1.2","88","Application Data"
"200","15.493165","10.42.0.21","3.217.132.36","TCP","54","56464  >  443 [ACK] Seq=815 Ack=6830 Win=2266 Len=0"
"201","15.493379","10.42.0.21","3.217.132.36","TCP","54","56464  >  443 [ACK] Seq=815 Ack=6864 Win=2266 Len=0"
"202","15.535460","10.42.0.21","3.217.132.36","TCP","54","56464  >  443 [FIN, ACK] Seq=815 Ack=6864 Win=2266 Len=0"
"203","15.626073","3.217.132.36","10.42.0.21","TCP","54","443  >  56464 [ACK] Seq=6864 Ack=816 Win=65535 Len=0"
"204","15.626082","3.217.132.36","10.42.0.21","TCP","54","443  >  56464 [FIN, ACK] Seq=6864 Ack=816 Win=65535 Len=0"
"205","15.629910","10.42.0.21","3.217.132.36","TCP","54","56464  >  443 [ACK] Seq=816 Ack=6865 Win=2265 Len=0"
"206","15.844021","10.42.0.230","54.225.9.71","TCP","58","56732  >  8883 [SYN] Seq=0 Win=5744 Len=0 MSS=1436"
"207","15.933641","54.225.9.71","10.42.0.230","TCP","58","[TCP Port numbers reused] 8883  >  56732 [SYN, ACK] Seq=0 Ack=1 Win=8961 Len=0 MSS=1360"
"208","16.208384","::","ff02::1:ff7d:838c","ICMPv6","78","Neighbor Solicitation for fe80::c0a7:bb78:7d7d:838c"
"209","16.208420","fe80::c0a7:bb78:7d7d:838c","ff02::1","ICMPv6","86","Neighbor Advertisement fe80::c0a7:bb78:7d7d:838c (rtr, ovr) is at 2c:cf:67:1c:40:40"
"210","16.966180","54.225.9.71","10.42.0.230","TCP","58","[TCP Retransmission] 8883  >  56732 [SYN, ACK] Seq=0 Ack=1 Win=8961 Len=0 MSS=1360"
"211","17.211466","::","ff02::1:ff7d:838c","ICMPv6","78","Neighbor Solicitation for fe80::c0a7:bb78:7d7d:838c"
"212","17.211501","fe80::c0a7:bb78:7d7d:838c","ff02::1","ICMPv6","86","Neighbor Advertisement fe80::c0a7:bb78:7d7d:838c (rtr, ovr) is at 2c:cf:67:1c:40:40"
"213","18.228872","::","ff02::1:ff7d:838c","ICMPv6","78","Neighbor Solicitation for fe80::c0a7:bb78:7d7d:838c"
"214","18.228906","fe80::c0a7:bb78:7d7d:838c","ff02::1","ICMPv6","86","Neighbor Advertisement fe80::c0a7:bb78:7d7d:838c (rtr, ovr) is at 2c:cf:67:1c:40:40"
"215","18.440155","Raspberr_1c:40:40","Tp-LinkT_5d:4d:08","ARP","42","Who has 10.42.0.21? Tell 10.42.0.1"
"216","18.444028","Tp-LinkT_5d:4d:08","Raspberr_1c:40:40","ARP","42","10.42.0.21 is at 74:da:88:5d:4d:08"
"217","18.685523","10.42.0.105","10.42.0.21","TCP","74","54462  >  9999 [SYN] Seq=0 Win=65535 Len=0 MSS=1460 SACK_PERM TSval=347547897 TSecr=0 WS=1024"
"218","18.685547","10.42.0.21","10.42.0.105","TCP","58","9999  >  54462 [SYN, ACK] Seq=0 Ack=1 Win=1452 Len=0 MSS=1452"
"219","18.685567","10.42.0.105","10.42.0.21","TCP","54","54462  >  9999 [ACK] Seq=1 Ack=1 Win=65535 Len=0"
"220","18.686080","10.42.0.105","10.42.0.21","TPLINK-SMARTHOME/JSON","160","TCP Cmd: {""context"":{""source"":""46a4d58b-6279-432c-ae23-e115c2db8354""},""system"":{""set_relay_state"":{""state"":0}}}"
"221","18.686227","10.42.0.21","10.42.0.105","TCP","54","[TCP Window Update] 9999  >  54462 [ACK] Seq=1 Ack=1 Win=2904 Len=0"
"222","18.686888","10.42.0.21","10.42.0.105","TCP","54","9999  >  54462 [ACK] Seq=1 Ack=107 Win=2420 Len=0"
"223","18.719929","10.42.0.21","10.42.0.105","TCP","54","[TCP Window Update] 9999  >  54462 [ACK] Seq=1 Ack=107 Win=2904 Len=0"
"224","18.719949","10.42.0.21","10.42.0.105","TPLINK-SMARTHOME/JSON","103","TCP Rsp: {""system"":{""set_relay_state"":{""err_code"":0}}}"
"225","18.722443","10.42.0.105","10.42.0.21","TCP","54","54462  >  9999 [ACK] Seq=107 Ack=50 Win=65535 Len=0"
"226","18.723005","10.42.0.21","10.42.0.105","TCP","54","[TCP Dup ACK 222#1] 9999  >  54462 [ACK] Seq=50 Ack=107 Win=2904 Len=0"
"227","18.724181","10.42.0.105","10.42.0.21","TCP","54","54462  >  9999 [FIN, ACK] Seq=107 Ack=50 Win=65535 Len=0"
"228","18.724717","10.42.0.21","10.42.0.105","TCP","54","9999  >  54462 [ACK] Seq=50 Ack=108 Win=2420 Len=0"
"229","18.739932","10.42.0.21","3.217.132.36","TCP","58","56465  >  443 [SYN] Seq=0 Win=1452 Len=0 MSS=1452"
"230","18.832473","3.217.132.36","10.42.0.21","TCP","58","443  >  56465 [SYN, ACK] Seq=0 Ack=1 Win=26883 Len=0 MSS=1360"
"231","18.836109","10.42.0.21","3.217.132.36","TCP","54","56465  >  443 [ACK] Seq=1 Ack=1 Win=2040 Len=0"
"232","18.861720","10.42.0.21","10.42.0.105","TCP","54","9999  >  54462 [FIN, ACK] Seq=50 Ack=108 Win=2178 Len=0"
"233","18.862841","10.42.0.21","3.217.132.36","TLSv1.2","196","Client Hello"
"234","18.863803","10.42.0.105","10.42.0.21","TCP","54","54462  >  9999 [ACK] Seq=108 Ack=51 Win=65535 Len=0"
"235","18.865459","10.42.0.230","54.225.9.71","TCP","58","[TCP Retransmission] 56732  >  8883 [SYN] Seq=0 Win=5744 Len=0 MSS=1436"
"236","18.954858","54.225.9.71","10.42.0.230","TCP","58","[TCP Retransmission] 8883  >  56732 [SYN, ACK] Seq=0 Ack=1 Win=8961 Len=0 MSS=1360"
"237","18.956350","3.217.132.36","10.42.0.21","TLSv1.2","1414","Server Hello"
"238","19.016121","10.42.0.21","3.217.132.36","TCP","54","56465  >  443 [ACK] Seq=143 Ack=1361 Win=2266 Len=0"
"239","19.115817","3.217.132.36","10.42.0.21","TCP","1414","443  >  56465 [ACK] Seq=1361 Ack=143 Win=65535 Len=1360 [TCP segment of a reassembled PDU]"
"240","19.120969","10.42.0.21","3.217.132.36","TCP","54","56465  >  443 [ACK] Seq=143 Ack=2721 Win=2266 Len=0"
"241","19.211471","3.217.132.36","10.42.0.21","TCP","1414","443  >  56465 [ACK] Seq=2721 Ack=143 Win=65535 Len=1360 [TCP segment of a reassembled PDU]"
"242","19.215378","10.42.0.21","3.217.132.36","TCP","54","56465  >  443 [ACK] Seq=143 Ack=4081 Win=2266 Len=0"
"243","19.231316","::","ff02::1:ff7d:838c","ICMPv6","78","Neighbor Solicitation for fe80::c0a7:bb78:7d7d:838c"
"244","19.231343","fe80::c0a7:bb78:7d7d:838c","ff02::1","ICMPv6","86","Neighbor Advertisement fe80::c0a7:bb78:7d7d:838c (rtr, ovr) is at 2c:cf:67:1c:40:40"
"245","19.306340","3.217.132.36","10.42.0.21","TLSv1.2","1180","Certificate"
"246","19.306349","3.217.132.36","10.42.0.21","TLSv1.2","401","Server Key Exchange, Server Hello Done"
"247","19.421623","10.42.0.21","3.217.132.36","TCP","54","56465  >  443 [ACK] Seq=143 Ack=5207 Win=2266 Len=0"
"248","19.669240","10.42.0.21","3.217.132.36","TLSv1.2","180","Client Key Exchange, Change Cipher Spec, Encrypted Handshake Message"
"249","19.689176","10.42.0.21","3.217.132.36","TCP","54","[TCP Dup ACK 248#1] 56465  >  443 [ACK] Seq=269 Ack=5554 Win=2266 Len=0"
"250","19.759764","3.217.132.36","10.42.0.21","TLSv1.2","105","Change Cipher Spec, Encrypted Handshake Message"
"251","19.765545","10.42.0.21","3.217.132.36","TCP","54","56465  >  443 [ACK] Seq=269 Ack=5605 Win=2266 Len=0"
"252","19.841027","10.42.0.21","3.217.132.36","TLSv1.2","601","Application Data"
"253","19.937606","3.217.132.36","10.42.0.21","TLSv1.2","1280","Application Data"
"254","19.937619","3.217.132.36","10.42.0.21","TLSv1.2","88","Application Data"
"255","19.948602","10.42.0.21","3.217.132.36","TCP","54","56465  >  443 [ACK] Seq=816 Ack=6831 Win=2266 Len=0"
"256","19.949122","10.42.0.21","3.217.132.36","TCP","54","56465  >  443 [ACK] Seq=816 Ack=6865 Win=2266 Len=0"
"257","19.991407","10.42.0.21","3.217.132.36","TCP","54","56465  >  443 [FIN, ACK] Seq=816 Ack=6865 Win=2266 Len=0"
"258","20.081084","3.217.132.36","10.42.0.21","TCP","54","443  >  56465 [ACK] Seq=6865 Ack=817 Win=65535 Len=0"
"259","20.081106","3.217.132.36","10.42.0.21","TCP","54","443  >  56465 [FIN, ACK] Seq=6865 Ack=817 Win=65535 Len=0"
"260","20.085367","10.42.0.21","3.217.132.36","TCP","54","56465  >  443 [ACK] Seq=817 Ack=6866 Win=2265 Len=0"
"261","20.245115","::","ff02::1:ff7d:838c","ICMPv6","78","Neighbor Solicitation for fe80::c0a7:bb78:7d7d:838c"
"262","20.245146","fe80::c0a7:bb78:7d7d:838c","ff02::1","ICMPv6","86","Neighbor Advertisement fe80::c0a7:bb78:7d7d:838c (rtr, ovr) is at 2c:cf:67:1c:40:40"
"263","20.991241","54.225.9.71","10.42.0.230","TCP","58","[TCP Retransmission] 8883  >  56732 [SYN, ACK] Seq=0 Ack=1 Win=8961 Len=0 MSS=1360"
"264","21.000155","Raspberr_1c:40:40","WiZConne_2e:2f:aa","ARP","42","Who has 10.42.0.230? Tell 10.42.0.1"
"265","21.256843","::","ff02::1:ff7d:838c","ICMPv6","78","Neighbor Solicitation for fe80::c0a7:bb78:7d7d:838c"
"266","21.256875","fe80::c0a7:bb78:7d7d:838c","ff02::1","ICMPv6","86","Neighbor Advertisement fe80::c0a7:bb78:7d7d:838c (rtr, ovr) is at 2c:cf:67:1c:40:40"
"267","21.541377","10.42.0.105","10.42.0.21","TCP","74","54478  >  9999 [SYN] Seq=0 Win=65535 Len=0 MSS=1460 SACK_PERM TSval=347550751 TSecr=0 WS=1024"
"268","21.541405","10.42.0.21","10.42.0.105","TCP","58","9999  >  54478 [SYN, ACK] Seq=0 Ack=1 Win=1452 Len=0 MSS=1452"
"269","21.545450","10.42.0.105","10.42.0.21","TCP","54","54478  >  9999 [ACK] Seq=1 Ack=1 Win=65535 Len=0"
"270","21.546026","10.42.0.105","10.42.0.21","TPLINK-SMARTHOME/JSON","160","TCP Cmd: {""context"":{""source"":""46a4d58b-6279-432c-ae23-e115c2db8354""},""system"":{""set_relay_state"":{""state"":1}}}"
"271","21.546624","10.42.0.21","10.42.0.105","TCP","54","[TCP Window Update] 9999  >  54478 [ACK] Seq=1 Ack=1 Win=2904 Len=0"
"272","21.547103","10.42.0.21","10.42.0.105","TCP","54","9999  >  54478 [ACK] Seq=1 Ack=107 Win=2420 Len=0"
"273","21.579409","10.42.0.21","10.42.0.105","TCP","54","[TCP Window Update] 9999  >  54478 [ACK] Seq=1 Ack=107 Win=2904 Len=0"
"274","21.579445","10.42.0.21","10.42.0.105","TPLINK-SMARTHOME/JSON","103","TCP Rsp: {""system"":{""set_relay_state"":{""err_code"":0}}}"
"275","21.579914","10.42.0.105","10.42.0.21","TCP","54","54478  >  9999 [ACK] Seq=107 Ack=50 Win=65535 Len=0"
"276","21.580481","10.42.0.21","10.42.0.105","TCP","54","[TCP Dup ACK 272#1] 9999  >  54478 [ACK] Seq=50 Ack=107 Win=2904 Len=0"
"277","21.582295","10.42.0.105","10.42.0.21","TCP","54","54478  >  9999 [FIN, ACK] Seq=107 Ack=50 Win=65535 Len=0"
"278","21.583436","10.42.0.21","10.42.0.105","TCP","54","9999  >  54478 [ACK] Seq=50 Ack=108 Win=2420 Len=0"
"279","21.594850","10.42.0.21","3.217.132.36","TCP","58","56466  >  443 [SYN] Seq=0 Win=1452 Len=0 MSS=1452"
"280","21.689873","3.217.132.36","10.42.0.21","TCP","58","443  >  56466 [SYN, ACK] Seq=0 Ack=1 Win=26883 Len=0 MSS=1360"
"281","21.692771","10.42.0.21","3.217.132.36","TCP","54","56466  >  443 [ACK] Seq=1 Ack=1 Win=2040 Len=0"
"282","21.721093","10.42.0.21","10.42.0.105","TCP","54","9999  >  54478 [FIN, ACK] Seq=50 Ack=108 Win=2178 Len=0"
"283","21.722092","10.42.0.21","3.217.132.36","TLSv1.2","196","Client Hello"
"284","21.724049","10.42.0.105","10.42.0.21","TCP","54","54478  >  9999 [ACK] Seq=108 Ack=51 Win=65535 Len=0"
"285","21.817722","3.217.132.36","10.42.0.21","TLSv1.2","1414","Server Hello"
"286","21.821885","10.42.0.21","3.217.132.36","TCP","54","56466  >  443 [ACK] Seq=143 Ack=1361 Win=2266 Len=0"
"287","21.904376","10.42.0.230","54.225.9.71","TCP","58","[TCP Retransmission] 56732  >  8883 [SYN] Seq=0 Win=5744 Len=0 MSS=1436"
"288","21.912686","3.217.132.36","10.42.0.21","TCP","1414","443  >  56466 [ACK] Seq=1361 Ack=143 Win=65535 Len=1360 [TCP segment of a reassembled PDU]"
"289","21.913555","10.42.0.21","3.217.132.36","TCP","54","56466  >  443 [ACK] Seq=143 Ack=2721 Win=2266 Len=0"
"290","21.994885","54.225.9.71","10.42.0.230","TCP","58","[TCP Retransmission] 8883  >  56732 [SYN, ACK] Seq=0 Ack=1 Win=8961 Len=0 MSS=1360"
"291","22.003918","3.217.132.36","10.42.0.21","TCP","1414","443  >  56466 [ACK] Seq=2721 Ack=143 Win=65535 Len=1360 [TCP segment of a reassembled PDU]"
"292","22.024154","Raspberr_1c:40:40","WiZConne_2e:2f:aa","ARP","42","Who has 10.42.0.230? Tell 10.42.0.1"
"293","22.029351","10.42.0.21","3.217.132.36","TCP","54","56466  >  443 [ACK] Seq=143 Ack=4081 Win=2266 Len=0"
"294","22.120104","3.217.132.36","10.42.0.21","TLSv1.2","1180","Certificate"
"295","22.120119","3.217.132.36","10.42.0.21","TLSv1.2","401","Server Key Exchange, Server Hello Done"
"296","22.234400","10.42.0.21","3.217.132.36","TCP","54","56466  >  443 [ACK] Seq=143 Ack=5207 Win=2266 Len=0"
"297","22.280806","::","ff02::1:ff7d:838c","ICMPv6","78","Neighbor Solicitation for fe80::c0a7:bb78:7d7d:838c"
"298","22.280834","fe80::c0a7:bb78:7d7d:838c","ff02::1","ICMPv6","86","Neighbor Advertisement fe80::c0a7:bb78:7d7d:838c (rtr, ovr) is at 2c:cf:67:1c:40:40"
"299","22.478640","10.42.0.21","3.217.132.36","TLSv1.2","180","Client Key Exchange, Change Cipher Spec, Encrypted Handshake Message"
"300","22.478697","10.42.0.21","3.217.132.36","TCP","54","[TCP Dup ACK 299#1] 56466  >  443 [ACK] Seq=269 Ack=5554 Win=2266 Len=0"
"301","22.571138","3.217.132.36","10.42.0.21","TLSv1.2","105","Change Cipher Spec, Encrypted Handshake Message"
"302","22.576937","10.42.0.21","3.217.132.36","TCP","54","56466  >  443 [ACK] Seq=269 Ack=5605 Win=2266 Len=0"
"303","22.628205","10.42.0.21","3.217.132.36","TLSv1.2","600","Application Data"
"304","22.728883","3.217.132.36","10.42.0.21","TLSv1.2","1279","Application Data"
"305","22.728896","3.217.132.36","10.42.0.21","TLSv1.2","88","Application Data"
"306","22.739871","10.42.0.21","3.217.132.36","TCP","54","56466  >  443 [ACK] Seq=815 Ack=6830 Win=2266 Len=0"
"307","22.740389","10.42.0.21","3.217.132.36","TCP","54","56466  >  443 [ACK] Seq=815 Ack=6864 Win=2266 Len=0"
"308","22.778745","10.42.0.21","3.217.132.36","TCP","54","56466  >  443 [FIN, ACK] Seq=815 Ack=6864 Win=2266 Len=0"
"309","22.868563","3.217.132.36","10.42.0.21","TCP","54","443  >  56466 [ACK] Seq=6864 Ack=816 Win=65535 Len=0"
"310","22.868572","3.217.132.36","10.42.0.21","TCP","54","443  >  56466 [FIN, ACK] Seq=6864 Ack=816 Win=65535 Len=0"
"311","22.872330","10.42.0.21","3.217.132.36","TCP","54","56466  >  443 [ACK] Seq=816 Ack=6865 Win=2265 Len=0"
"312","23.048154","Raspberr_1c:40:40","WiZConne_2e:2f:aa","ARP","42","Who has 10.42.0.230? Tell 10.42.0.1"
"313","23.294901","::","ff02::1:ff7d:838c","ICMPv6","78","Neighbor Solicitation for fe80::c0a7:bb78:7d7d:838c"
"314","23.294936","fe80::c0a7:bb78:7d7d:838c","ff02::1","ICMPv6","86","Neighbor Advertisement fe80::c0a7:bb78:7d7d:838c (rtr, ovr) is at 2c:cf:67:1c:40:40"
"315","24.297965","::","ff02::1:ff7d:838c","ICMPv6","78","Neighbor Solicitation for fe80::c0a7:bb78:7d7d:838c"
"316","24.297999","fe80::c0a7:bb78:7d7d:838c","ff02::1","ICMPv6","86","Neighbor Advertisement fe80::c0a7:bb78:7d7d:838c (rtr, ovr) is at 2c:cf:67:1c:40:40"
